{
  "iso2": "RS",
  "iso3": "SRB",
  "iso_numeric": "688",
  "name": "Serbia",
  "native_name": "Srbija",
  "demonym": "Serbian",
  "continent": "EU",
  "region": "Balkans",
  "capital": "Belgrade",
  "currency": "RSD",
  "languages": [
    "rs"
  ],
  "dialing_code": "381",
  "tld": [
    ".rs"
  ],
  "area": 49037,
  "latlng": [
    44.016521,
    21.005859
  ],
  "timezones": [
    "Europe/Belgrade"
  ],
  "borders": [
    "AL",
    "BA",
    "BG",
    "HR",
    "HU",
    "ME",
    "MK",
    "RO",
    "XK"
  ]
}
